[
  {
    "schema_version": "signal-channel-v1",
    "channel_id": "noisy-point-half",
    "target_set": [0, 1, 2, 3],
    "prior": ["1/4", "1/4", "1/4", "1/4"],
    "signal_alphabet": [0, 1, 2, 3],
    "conditional_distribution": {"if_s_equals_theta": "1/2", "otherwise_each": "1/6"},
    "symmetry_class": "simultaneous S4 relabeling",
    "likelihood_ratios": {"matching_vs_nonmatching": "3/1"},
    "posterior_update": "prior(theta)*product_i W(s_i|theta), normalized",
    "private_bayes_action_correspondence": "the nominated point",
    "tie_breaking": "uniform on the Bayes correspondence using independent private randomness",
    "signal_cost": "0/1",
    "source_dependence": "conditionally-independent",
    "evaluation_mode": "exact-rational"
  },
  {
    "schema_version": "signal-channel-v1",
    "channel_id": "noisy-shortlist-three-quarters",
    "target_set": [0, 1, 2, 3],
    "prior": ["1/4", "1/4", "1/4", "1/4"],
    "signal_alphabet": ["01", "02", "03", "12", "13", "23"],
    "conditional_distribution": {"each_two_subset_containing_theta": "1/4", "each_two_subset_excluding_theta": "1/12"},
    "symmetry_class": "S4 action on targets and two-subsets",
    "likelihood_ratios": {"inclusion_vs_exclusion": "3/1"},
    "posterior_update": "prior(theta)*product_i W(S_i|theta), normalized",
    "private_bayes_action_correspondence": "both members of the observed two-subset",
    "tie_breaking": "uniform on the two Bayes actions using independent private randomness",
    "signal_cost": "0/1",
    "source_dependence": "conditionally-independent",
    "evaluation_mode": "exact-rational"
  },
  {
    "schema_version": "signal-channel-v1",
    "channel_id": "guaranteed-shortlist-two",
    "target_set": [0, 1, 2, 3],
    "prior": ["1/4", "1/4", "1/4", "1/4"],
    "signal_alphabet": ["01", "02", "03", "12", "13", "23"],
    "conditional_distribution": {"each_two_subset_containing_theta": "1/3", "each_two_subset_excluding_theta": "0/1"},
    "symmetry_class": "S4 action on targets and two-subsets",
    "likelihood_ratios": {"inclusion_vs_exclusion": "infinity"},
    "posterior_update": "uniform on the intersection-compatible targets, then normalized",
    "private_bayes_action_correspondence": "both members of the observed two-subset",
    "tie_breaking": "uniform on the two Bayes actions using independent private randomness",
    "signal_cost": "0/1",
    "source_dependence": "conditionally-independent",
    "evaluation_mode": "exact-rational"
  },
  {
    "schema_version": "signal-channel-v1",
    "channel_id": "explicit-exclusion",
    "target_set": [0, 1, 2, 3],
    "prior": ["1/4", "1/4", "1/4", "1/4"],
    "signal_alphabet": [0, 1, 2, 3],
    "conditional_distribution": {"excluded_label_equals_theta": "0/1", "each_other_excluded_label": "1/3"},
    "symmetry_class": "simultaneous S4 relabeling",
    "likelihood_ratios": {"compatible_vs_excluded": "infinity"},
    "posterior_update": "zero excluded targets and normalize the remaining prior mass",
    "private_bayes_action_correspondence": "all three non-excluded targets",
    "tie_breaking": "uniform on the three Bayes actions using independent private randomness",
    "signal_cost": "0/1",
    "source_dependence": "conditionally-independent",
    "evaluation_mode": "exact-rational"
  },
  {
    "schema_version": "signal-channel-v1",
    "channel_id": "confidence-point",
    "target_set": [0, 1, 2, 3],
    "prior": ["1/4", "1/4", "1/4", "1/4"],
    "signal_alphabet": ["0-low", "1-low", "2-low", "3-low", "0-high", "1-high", "2-high", "3-high"],
    "conditional_distribution": {"confidence_low": "1/2", "confidence_high": "1/2", "match_given_low": "1/2", "each_mismatch_given_low": "1/6", "match_given_high": "3/4", "each_mismatch_given_high": "1/12"},
    "symmetry_class": "S4 relabeling with confidence fixed",
    "likelihood_ratios": {"low_match_vs_mismatch": "3/1", "high_match_vs_mismatch": "9/1"},
    "posterior_update": "prior(theta)*product_i W((s_i,c_i)|theta), normalized",
    "private_bayes_action_correspondence": "the nominated point at either confidence",
    "tie_breaking": "unique Bayes action; independent randomness only if an accidental pooled tie occurs",
    "signal_cost": "0/1",
    "source_dependence": "conditionally-independent",
    "evaluation_mode": "exact-rational"
  }
]
